name,location,message,paper_use,readme_use,alt_text
01_eci_latin_america_trends,outputs/figures/png/01_eci_latin_america_trends.png,Latin America shows persistent but heterogeneous relative complexity trajectories.,Section 5,Hero/main figure,Line chart of annual ECI trajectories for Latin American countries with selected countries highlighted.
02_complexity_income,outputs/figures/png/02_complexity_income.png,Complexity is positively associated with income in cross-section but not interpreted causally.,Section 5,Main figures,Scatter plot of ECI and GDP per capita with Bolivia highlighted.
06_bolivia_product_space,outputs/figures/png/06_bolivia_product_space.png,"Bolivia occupies only part of the visual Product Space, with many higher-transformation products farther away.",Section 7,Main figures,Network visualization of Bolivia RCA products and opportunity categories in the Product Space.
08_bolivia_opportunity_matrix,outputs/figures/png/08_bolivia_opportunity_matrix.png,Feasibility and transformation potential point to different product groups.,Section 8,Main figures,Scatter plot comparing feasibility and transformation scores for Bolivia opportunity candidates.
09_bolivia_top_opportunities,outputs/figures/png/09_bolivia_top_opportunities.png,"Top transformation candidates are screening priorities for sector study, not investment prescriptions.",Section 8,Main figures,Horizontal bar chart of top Bolivia transformation opportunity scores.
10_model_coefficients,outputs/figures/png/10_model_coefficients.png,Fixed-effects coefficients are observational and should be read with uncertainty intervals.,Section 6,Main figures,Coefficient plot for observational fixed-effects models with confidence intervals.
